,info,title,advantage,drawback,opinion,promotion,welfaresalary,worklifebalance,culture,executives,total,date,region,workingstatus,department
0,연구개발 | 현직원 | 경기 | 2019/8/24,회사 규모에 비해 체계가 없는 곳 생각보다 연봉수준이 낮을 수 있음 원치않는 일을 오랫동안 하게 될수도 있음,회식분위기 좋은 편 윗사람과 크게 부딪힐 일 없어 일하기 편함 회사 복지 제도 많은 편,PS제외하면 연봉이 높은편이 아니라서 급여 수준이 유동적임 원하지 않는 일을 오래 해야할수도 있음,현재 티오에 맞는 인사제도가 필요할거 같음,4.0,4.0,2.0,3.0,3.0,3.2,2019-08-24 00:00:00, 경기 , 현직원 ,연구개발 
1,생산/제조 | 현직원 | 경기 | 2019/8/24,복지와 급여는 우수하나 교대근무로 인한 불규칙적인 생활이 힘듬,자율출퇴근제 체계적인 업무 시스템 밥 세끼 공짜 적당한 수준의 급여,교대 근무로 인한 불규칙적인 생활 방진복을 매일같이 입어야하는 불편함 높은 업무 강도,인원을 늘려 주 5일 근무체제로 바뀌어야 합니다 주말 이틀 중 하루는 휴식이 보장되길 바랍니다,3.0,4.0,2.0,3.0,3.0,3.0,2019-08-24 00:00:00, 경기 , 현직원 ,생산/제조 
2,엔지니어링 | 전직원 | 경기 | 2019/8/23,젊은사람들과 일하며 함께 도전하는것을 좋아하는 인재들에게는 적합한 직장,항상 현실이 안주하지 않고 발전하려 노력하는 에너지를 가지고 있는 회사임,일이 힘들다보니 다소 경직된 모습이있으며 사람들이 여유가없다,물론 일이 많은 것은 인정하지만 워라밸을 위해 노력해주었으면 좋겠음,3.0,5.0,2.0,3.0,2.0,3.0,2019-08-23 00:00:00, 경기 , 전직원 ,엔지니어링 
3,서비스/고객지원 | 전직원 | 서울 | 2019/8/23,글로벌 회사에서 소중한 경험을 했고 앞으로도 이런일은 없을 수도 있겟지,자율 출퇴근 근무제도 다양하고 편안한 복지 넓은 나만의 장소,나보다 나이 많은 사람들이 많아 의견을 잘 얘기하지 못함,그래도 일하는동안은 만족했고 답답한 마음은 잇엇지만 견딜만 합니다,2.0,4.0,4.0,4.0,3.0,3.4,2019-08-23 00:00:00, 서울 , 전직원 ,서비스/고객지원 
4,인사/총무 | 현직원 | 경기 | 2019/8/23,국내에서 손꼽히는 기업인 만큼 다양한 인재가 모여있는 곳이다,외국계 회사의 복지는 알지 못하지만 뒤쳐지지 않는 복지를 가지고 있다고 생각한다,행정서무 인력을 비효율적으로 2년마다 변경하는 방식이며 몇가지 업무 처리 프로세스가 비효율적으로 운영되고 있다,행정서무 인력이 조금 더 실력을 인정받으면 다른 대우를 받았으면 합니다,2.0,5.0,5.0,4.0,5.0,4.2,2019-08-23 00:00:00, 경기 , 현직원 ,인사/총무 
5,IT/인터넷 | 현직원 | 경기 | 2019/8/21,복지가 좋고 연봉이 높습니다 기업분위기도 좋습니다,식대 하루 세번 무료에 복지가 좋습니다 성과금이 많이 나와서 연봉도 높습니다,단순 보고를 위한 업무가 많아 비효율적입니다 제조회사 프로세스에 최적화되어있어 서비스 업무가 원활하지 않습니다,신규 사업 의지에 적극적인 투자를 지원해줬으면 합니다,4.0,5.0,4.0,3.0,2.0,3.6,2019-08-21 00:00:00, 경기 , 현직원 ,IT/인터넷 
6,영업/제휴 | 전직원 | 경기 | 2019/8/21,시스템으로 모든 것이 돌아가는 회사 시스템은 국내 기업 중에 가장 탄탄한 거 같습니다,삼성이라는 브랜드가 국내외 이직하기에 도움이 많이 됩니다,굉장히 딱딱한 조직문화 상사가 퇴근하기 전에는 집에 갈 생각 못함,조직문화 개선 부조리한 업무 형태 개선,3.0,4.0,1.0,2.0,3.0,2.6,2019-08-21 00:00:00, 경기 , 전직원 ,영업/제휴 
7,연구개발 | 전직원 | 경기 | 2019/8/21,기업 문화가 지속적으로 개선되고 있었으며 연구개발에 대한 대우가 좋음,연차를 윗사람 눈치 안보고 사용했고 기업 문화가 점점 좋아짐,팀바이팀 따라 근무 양이 달라질 수 있으며 부서에 따른 고과 차이도 있음 물론 일반적,지속적으로 합리적인 보상 체계와 근무환경 조성을 해 주시기 바랍니다,3.0,5.0,4.0,4.0,4.0,4.0,2019-08-21 00:00:00, 경기 , 전직원 ,연구개발 
8,엔지니어링 | 현직원 | 경기 | 2019/8/21,돈만큼 일해야합니다 하지만 급여와 복지는 확실합니다,돈은 정말 만족스럽게 주는 게 큰 장점입니다 일이 힘들어도 월급날 보면서 버티고 있습니다 근무는 예전보다 더 나아진건 확실합니다,그치만 그만큼 일이 힘든건 감안 하셔야 합니다 부서마다 아직 수직적 구조가 있는 곳도 아직 있는 것 같습니다,신규 사업 추진에 있어서 조금 더 빠르게 소식을 전해줬으면 좋겠습니다,5.0,5.0,4.0,4.0,4.0,4.4,2019-08-21 00:00:00, 경기 , 현직원 ,엔지니어링 
9,영업/제휴 | 전직원 | 경기 | 2019/8/21,나오면 알게 될 것이다 갓성전자라는 말이 괜히 있는게 아니다,역시 유연근무제 자율출퇴근 다양한 아이디어 제출과 빠른 수렴과 수정과 보완,어딜가나 있는 사내 정치질과 줄서기 근무시간이 부족할 정도의 초과근무,미래 지향적인 아이템에 대해 과감한 투자를 해야할 것 같음 안되겠다 싶으면 인수 합병도 좋은 방법인데 주주들이 싫어하니까 그에 상응하는 게런티를 주는건 어떤지,3.0,5.0,4.0,5.0,2.0,3.8,2019-08-21 00:00:00, 경기 , 전직원 ,영업/제휴 
10,디자인 | 전직원 | 서울 | 2019/8/21,복지 최강 개발자들은 많이 힘들어보이나 디자이너가 다니기에 문제 없고 결혼하고도 다니기 좋은 회사 수원사업장과는 다른 분위기 워라벨 좋음,자유롭고 IT회사의 최대 장점은 다 있습니다 인센 많이 주고요,보고하는 건이 많아 불필요한 시간이 너무 많다 생각합니다,회의 시간을 줄이고 시간을 지켜주셨으면 합니다 간혹 늦게 들어오신적이있으셔서,1.0,5.0,5.0,5.0,1.0,3.4,2019-08-21 00:00:00, 서울 , 전직원 ,디자인 
11,연구개발 | 전직원 | 경기 | 2019/8/21,대기업의 혜택은 다 보는 곳 확실히 임직원 복지는 뛰어남,임직원 복지가 좋고 근무출퇴근 환경은 좋음 다만 사업부 또는 부서별 편차는 심함,보고를 위한 보고서 작성 많음 편차는 있겠지만 임원 의전 심하고 사업이 잘되는 사업부 안되는 사업부 분위기 차이 많이남,사업이 잘 안되는 사업부는 근본원인부터 좀 찾고 임직원 의욕 고취에 힘써주시길,3.0,5.0,3.0,4.0,3.0,3.6,2019-08-21 00:00:00, 경기 , 전직원 ,연구개발 
12,영업/제휴 | 전직원 | 경기 | 2019/8/20,금전적인 보상은 많습니다만 사업부별로 성과급 차이가 큽니다 기업 네임벨류가 좋다보니 사회적으로 인정받는다는 부분이 가장 좋습니다,금전적 보상 국내 최고 대기업다운 복리후생 자기 계발에 대한 적극적인 지원 지역전문가 해외주재원 등 해외 근무의 기회 제공,내부 경쟁이 치열한 편 위로 올라갈수록 승진이 어렵고 퇴직의 압박이 있는 편,수직적인 문화가 남아있고 다소 불합리한 성과평가강제적인 하위 고과 분배 등등,3.0,5.0,2.0,2.0,3.0,3.0,2019-08-20 00:00:00, 경기 , 전직원 ,영업/제휴 
13,경영/기획/컨설팅 | 현직원 | 서울 | 2019/8/20,개발자가 대우받으면서 일할수 있는 곳,일단 연봉 및 근무환경 복지가 좋다고 하지만 복지를 누릴 시간이 없음,업무의 강도와 스트레스가 타 회사와 비교하여 다소 많은 것으로 추정됨,,3.0,3.0,3.0,3.0,3.0,3.0,2019-08-20 00:00:00, 서울 , 현직원 ,경영/기획/컨설팅 
14,연구개발 | 현직원 | 경기 | 2019/8/20,외부에서 보기엔 좋지않지만 나름 기업문화를 선도하는 대표적인 회사,유연근무제 시행으로 시간활용이 용이하고 수입이 높은편이어서 만족함 임산부에 대한 대우가 좋음,다른회사와 마찬가지로 일에만 집중하기보다 여러 요소가 개입됨 부서간의 실적경쟁때문에 협업이 원활하지 않은 경우가 많음,좀더 맘껏 역량을 발휘할수 있는 곳으로 발전되기를 바랍니다,3.0,5.0,4.0,4.0,3.0,3.8,2019-08-20 00:00:00, 경기 , 현직원 ,연구개발 
15,연구개발 | 전직원 | 경기 | 2019/8/20,그래도 열심히 일했던 회사 열심히 한다는게 누굴 위한거였던지 나이대가 많다,통근버스가 엄청 많다 장가는 잘갈수 있다 본인보다 부모가 좋아하는 회사,꼰대가 많다 열심히 해봐야 남좋은 일 시킨다 회사 동료가 없다 다 경쟁자,사람좀 믿었으면 좋겠다 매일 보고만 하는 회사 회사 가는게 힘들었습니다 꼰대가 많다,2.0,5.0,3.0,2.0,3.0,3.0,2019-08-20 00:00:00, 경기 , 전직원 ,연구개발 
16,생산/제조 | 전직원 | 경기 | 2019/8/19,반도체 산업에서 단연 압도적인 회사 배울 점이 많다,무엇보다 복지와 급여가 만족스러우며 기숙사 제공이 되기때문에 편하다,교대근무가 필수적인 직군이 있기 때문에 해당 근무형태가 맞지 않는다면 힘들것이다,직원들과 적절한 커뮤니케이션이 더 이루어졌으면 좋겠다,4.0,4.0,4.0,4.0,4.0,4.0,2019-08-19 00:00:00, 경기 , 전직원 ,생산/제조 
17,IT/인터넷 | 전직원 | 경기 | 2019/8/18,국내 최고 기업의 복지를 실감할 수 있었던 복지는 정말 최고인 회사,다양한 복지 혜택과 문화 생활을 즐길 수 있어 좋았어요,눈치성 잔업과 비효율적인 프로세스가 여전히 많다 부서별로 분위기가 많이 다르다,직원들의 불만을 듣는 간담회와 함께 해결책을 공유할 수 있는자리가 많았으면 좋겠습니다,3.0,5.0,4.0,5.0,4.0,4.2,2019-08-18 00:00:00, 경기 , 전직원 ,IT/인터넷 
18,경영/기획/컨설팅 | 전직원 | 서울 | 2019/8/17,대우받으면서 보람차게 일할수잇는곳이며 대외적으로 절대 밀리지 않는 느낌을 가질수잇다,자기계발비용 지원 윗사람 눈치 크게안볼수잇음 휴가 자유로우며 수평적 분위기,부서마다 차이가 잇지만 야근이나 문화적으로 다소 뒤처지는 부서존재,힘든 시기이지만 앞으로 계속 성장해나가는 삼성이 되엇으면 합니다,4.0,4.0,4.0,4.0,4.0,4.0,2019-08-17 00:00:00, 서울 , 전직원 ,경영/기획/컨설팅 
19,생산/제조 | 현직원 | 경기 | 2019/8/16,젊은기업 그만큼 젊은사람이 다니긴 좋지만 입사직후부터 경쟁을 강요하며 젊기때문에 나이들어선 다닐수 없는 회사,밥 잘나옴 돈 괜찮음 주 52시간 매우 잘지켜짐 네임벨류 있음 업무강도 생각보다 할만함,원치않는 특근이 너무 많으며 교대근무도 마찬가지 회사상황에 따라 널뛰기하는 연봉 부장이상이 매우매우 적어서 40살 이상부터 내가 여길 다닐수 잇길 할까라는 의문이 입사1년차부터 들게되는 회사,특근 시킬바에 사람 조금만 더 뽑아서 특근 없애주십쇼 ㅠ,3.0,5.0,4.0,5.0,4.0,4.2,2019-08-16 00:00:00, 경기 , 현직원 ,생산/제조 
